{
  "fund_id": "hdfc_manufacturing",
  "fund_name": "HDFC Manufacturing Fund",
  "source_url": "https://www.indmoney.com/mutual-funds/hdfc-manufacturing-fund-direct-growth-1045641",
  "plan_type": "Direct Plan - Growth",
  "category": "Equity - Sectoral",
  "overview": {
    "nav": "₹11.03",
    "nav_date": "06 Mar 2026",
    "benchmark": "Nifty India Manufacturing TR INR"
  },
  "returns": {
    "1M": "1.58%",
    "3M": "1.31%",
    "6M": "0.66%",
    "1Y": "16.57%",
    "3Y": "--",
    "5Y": "--",
    "since_inception": null,
    "benchmark_returns": {
      "1M": "1.14%",
      "3M": "2.8%",
      "6M": "1.48%",
      "1Y": "13.32%",
      "3Y": "15.9%",
      "5Y": "13.06%"
    }
  },
  "costs": {
    "expense_ratio": "0.83%",
    "exit_load": "1% if redeemed in 0-1 Months",
    "stamp_duty": null,
    "transaction_charges": null
  },
  "risk": {
    "riskometer": "Very High",
    "risk_category": null,
    "lock_in_period": "None",
    "suitable_for": null
  },
  "investment": {
    "minimum_sip": "₹100",
    "minimum_lumpsum": "₹100",
    "sip_frequency": null,
    "additional_purchase_min": null
  },
  "portfolio": {
    "top_holdings": [
      {
        "name": "Reliance Industries Ltd",
        "pct": "5.7%"
      },
      {
        "name": "Maruti Suzuki India Ltd",
        "pct": "4.83%"
      },
      {
        "name": "Divi's Laboratories Ltd",
        "pct": "4.1%"
      }
    ],
    "sector_allocation": null,
    "total_holdings": null,
    "portfolio_turnover": null
  },
  "aum": {
    "value": "₹10338 Cr",
    "date": null,
    "trend": null
  },
  "manager": {
    "name": "Rakesh Sethia",
    "experience": null,
    "qualification": null,
    "other_funds_managed": null
  },
  "inception_date": "N/A",
  "faqs": [
    {
      "question": "How do I invest in HDFC Manufacturing Fund?",
      "answer": "INDmoney makes it simple to invest in the HDFC Manufacturing Fund. To do so, follow the steps below:Download the INDmoney app.Search for ‘HDFC Manufacturing Fund’.Select whether you want to invest in SIP or lump sum.Enter the amount you wish to invest.Set up payments via bank mandate or UPI."
    },
    {
      "question": "What is the current NAV of HDFC Manufacturing Fund?",
      "answer": "The NAV of the fund today is ₹11.03. NAV or Net Asset Value is the per unit price of a mutual fund. For example, if the NAV of a fund is ₹10, it means you can get 1000 units of that mutual fund at ₹10,000."
    },
    {
      "question": "What is the return on the fund?",
      "answer": "HDFC Manufacturing Fund fund has generated a return of 16.57% in 1 year"
    },
    {
      "question": "Who is the fund manager of HDFC Manufacturing Fund?",
      "answer": "The fund managers are Rakesh Sethia, Dhruv Muchhal."
    },
    {
      "question": "What is the exit load of the fund?",
      "answer": "The exit load is 1% if redeemed in 0-1 Months. Exit load is a fee levied for ‘exiting’ the fund earlier than a stipulated period, usually 1 year."
    },
    {
      "question": "What is the expense ratio of the fund?",
      "answer": "The expense ratio is 0.83%. The Expense Ratio is a fee charged for managing the fund. This includes commissions, administrative costs etc."
    },
    {
      "question": "What is the AUM of the fund?",
      "answer": "The AUM of the fund is ₹10338 Cr. AUM stands for Assets Under Management. It refers to the total assets managed by the fund."
    },
    {
      "question": "What are the top holdings of HDFC Manufacturing Fund?",
      "answer": "The top 3 holdings of the fund are Reliance Industries Ltd(5.7%), Maruti Suzuki India Ltd(4.83%), Divi's Laboratories Ltd(4.1%)"
    }
  ],
  "documents": {
    "sid_link": null,
    "kim_link": null,
    "factsheet_link": null
  },
  "scraped_at": "2026-03-08T06:42:27.943689+00:00"
}