{
  "fund_id": "hdfc_housing_opportunities",
  "fund_name": "HDFC Housing Opportunities Fund",
  "source_url": "https://www.indmoney.com/mutual-funds/hdfc-housing-opportunities-fund-direct-growth-9006",
  "plan_type": "Direct Plan - Growth",
  "category": "Equity - Sectoral",
  "overview": {
    "nav": "₹23.39",
    "nav_date": "06 Mar 2026",
    "benchmark": "Nifty Housing TR INR"
  },
  "returns": {
    "1M": "3.7%",
    "3M": "3.41%",
    "6M": "2.56%",
    "1Y": "10.88%",
    "3Y": "17.83%",
    "5Y": "15.76%",
    "since_inception": null,
    "benchmark_returns": {
      "1M": "1.14%",
      "3M": "2.8%",
      "6M": "1.48%",
      "1Y": "13.32%",
      "3Y": "15.9%",
      "5Y": "13.06%"
    }
  },
  "costs": {
    "expense_ratio": "1.19%",
    "exit_load": "1% if redeemed in 0-30 Days",
    "stamp_duty": null,
    "transaction_charges": null
  },
  "risk": {
    "riskometer": "Very High",
    "risk_category": null,
    "lock_in_period": "None",
    "suitable_for": null
  },
  "investment": {
    "minimum_sip": "₹100",
    "minimum_lumpsum": "₹100",
    "sip_frequency": null,
    "additional_purchase_min": null
  },
  "portfolio": {
    "top_holdings": [
      {
        "name": "HDFC Bank Ltd",
        "pct": "9.31%"
      },
      {
        "name": "Larsen & Toubro Ltd",
        "pct": "9.14%"
      },
      {
        "name": "State Bank of India",
        "pct": "7.77%"
      }
    ],
    "sector_allocation": null,
    "total_holdings": null,
    "portfolio_turnover": null
  },
  "aum": {
    "value": "₹1248 Cr",
    "date": null,
    "trend": null
  },
  "manager": {
    "name": "Srinivasan Ramamurthy",
    "experience": null,
    "qualification": null,
    "other_funds_managed": null
  },
  "inception_date": "N/A",
  "faqs": [
    {
      "question": "How do I invest in HDFC Housing Opportunities Fund?",
      "answer": "INDmoney makes it simple to invest in the HDFC Housing Opportunities Fund. To do so, follow the steps below:Download the INDmoney app.Search for ‘HDFC Housing Opportunities Fund’.Select whether you want to invest in SIP or lump sum.Enter the amount you wish to invest.Set up payments via bank mandate or UPI."
    },
    {
      "question": "What is the current NAV of HDFC Housing Opportunities Fund?",
      "answer": "The NAV of the fund today is ₹23.39. NAV or Net Asset Value is the per unit price of a mutual fund. For example, if the NAV of a fund is ₹10, it means you can get 1000 units of that mutual fund at ₹10,000."
    },
    {
      "question": "What is the return on the fund?",
      "answer": "HDFC Housing Opportunities Fund fund has generated a return of 10.88% in 1 year, 17.83% in 3 years, 15.76% in 5 years."
    },
    {
      "question": "Who is the fund manager of HDFC Housing Opportunities Fund?",
      "answer": "The fund managers are Srinivasan Ramamurthy, Dhruv Muchhal."
    },
    {
      "question": "What is the exit load of the fund?",
      "answer": "The exit load is 1% if redeemed in 0-30 Days. Exit load is a fee levied for ‘exiting’ the fund earlier than a stipulated period, usually 1 year."
    },
    {
      "question": "What is the expense ratio of the fund?",
      "answer": "The expense ratio is 1.19%. The Expense Ratio is a fee charged for managing the fund. This includes commissions, administrative costs etc."
    },
    {
      "question": "What is the AUM of the fund?",
      "answer": "The AUM of the fund is ₹1248 Cr. AUM stands for Assets Under Management. It refers to the total assets managed by the fund."
    },
    {
      "question": "What are the top holdings of HDFC Housing Opportunities Fund?",
      "answer": "The top 3 holdings of the fund are HDFC Bank Ltd(9.31%), Larsen & Toubro Ltd(9.14%), State Bank of India(7.77%)"
    }
  ],
  "documents": {
    "sid_link": null,
    "kim_link": null,
    "factsheet_link": null
  },
  "scraped_at": "2026-03-08T06:42:08.878393+00:00"
}